{
  "audio": {
    "music": {
      "city": "assets/audio/sfx/city/city.mp3",
      "office": "assets/audio/sfx/office/office.mp3",
      "rain": "assets/audio/music/Midnight_in_Santiago.mp3",
      "tension": "assets/audio/music/The_Scanner_s_Vigil.mp3"
    },
    "sfx": {
      "911": "assets/audio/sfx/mindblow sinister discovery.mp3",
      "confirm": "assets/audio/sfx/photo obturador.mp3",
      "dispatch": "assets/audio/sfx/mindblow sinister discovery.mp3",
      "error": "assets/audio/sfx/mindblow sinister discovery.mp3",
      "hevy_breathing": "assets/audio/sfx/running/heavy_breathing.mp3",
      "inicio": "assets/audio/sfx/inicio docu.mp3",
      "mensaje_cortado": "assets/audio/sfx/voice_cut_off/voice_cut_off.mp3",
      "message": "assets/audio/sfx/keyboard_sound_writing.mp3",
      "notif": "assets/audio/sfx/keyboard_sound_writing.mp3",
      "running": "assets/audio/sfx/running/running.mp3"
    }
  },
  "vignettes": {
    "alert": {
      "image": "assets/vignettes/alert.png",
      "label": "CANAL 911",
      "subtitle": "El silencio se rompe a las diez."
    },
    "arrival": {
      "image": "assets/images/eric llegando/1-1.png",
      "label": "PROVIDENCIA · CHILE",
      "subtitle": "Noche otoñal. Eric llega tarde a su primer turno."
    },
    "closure": {
      "image": "assets/vignettes/closure.png",
      "label": "INCIDENTE COMPLETADO",
      "subtitle": "Eric sobrevive a su primer caso. La noche sigue."
    },
    "eric_corre_1": {
      "image": "assets/vignettes/eric llegando/1-1.png",
      "label": "eric_corre_1",
      "subtitle": "primera aparicion de Eric"
    },
    "eric_llega_computador": {
      "image": "assets/vignettes/jefe le muestra oficina/2-3.png",
      "label": "eric_llega_computador",
      "subtitle": ""
    },
    "eric_llega_puerta_oficina": {
      "image": "assets/vignettes/jefe le muestra oficina/2.png",
      "label": "eric_llega_puerta_oficina",
      "subtitle": "Eric se queda parado en la entrada de la oficina sin entrar"
    },
    "eric_llega_una_luz_prendida": {
      "image": "assets/vignettes/eric llegando/1-4.png",
      "label": "eric_llega_una_luz_prendida",
      "subtitle": "Eric mira su telefono desde la calle y confirma que ha lelgado, sol ove una luz encendida en todo el edificio."
    },
    "eric_morral": {
      "image": "assets/vignettes/eric llegando/1-2.png",
      "label": "eric_morral",
      "subtitle": "A eric se le engancha su morral en un poste"
    },
    "eric_recoge_morral": {
      "image": "assets/vignettes/eric llegando/1-3.png",
      "label": "eric_recoge_morral",
      "subtitle": "Eric recoge las cosas que se cayeron de su morral"
    },
    "eric_supervisor_computador": {
      "image": "assets/vignettes/jefe le muestra oficina/2-1.png",
      "label": "eric_supervisor_computador",
      "subtitle": ""
    },
    "mensaje_dani": {
      "image": "assets/vignettes/jefe le muestra oficina/2-4.png",
      "label": "mensaje_dani",
      "subtitle": ""
    },
    "negro": {
      "image": "assets/vignettes/negro.png",
      "label": "negro",
      "subtitle": "pantalla en negro para texto"
    },
    "office": {
      "image": "assets/vignettes/office.png",
      "label": "CENTRO DE COMUNICACIONES",
      "subtitle": "Una estación vacía, un manual, una pantalla esperando."
    }
  },
  "cinema": {
    "image": "assets/images/eric llegando/1-1.png",
    "studio": "kabu studio",
    "title": "Dispatcher",
    "place": "Providencia · Chile · 21:11",
    "text": "Noche otoñal.<br>Está lloviendo.<br>Eric llega tarde a su primer día de trabajo."
  },
  "whatsapp": {
    "default_contact": "dani"
  },
  "contacts": {
    "dani": {
      "name": "Dani",
      "avatar": "D",
      "color": "#25d366",
      "status": "en línea"
    },
    "jefe_mario": {
      "name": "Jefe Mario",
      "avatar": "M",
      "color": "#f9e2af",
      "status": "sin mensajes nuevos",
      "messages": []
    }
  }
}